<?xml version="1.0" encoding="UTF-8"?>
<tns:Transaction MODULE_NAME="FTS" PROCESS_NAME="RniMaster" xmlns:tns="http://www.example.org/transactionSchema" xmlns:xsi="http://www.w3.org/2001/XMLSchema-instance" xsi:schemaLocation="http://www.example.org/transactionSchema transactionSchema.xsd ">
  <OPR ID="1" NAME="INSERT" BLOCK_SIZE="1" QRY_TOT_SIZE="1" TRN_MGMT="N">
	<BLOCK ID="1" QRY_SIZE="1" ROWS_INS="S" MANDATORY="Y">
	 <QRY ID="1" COL_SIZE="13">
	 INSERT INTO FTS_RNI_MST (NUM_RNI_ID,GNUM_SLNO,STR_RNI_CODE,STR_RNI_NAME,NUM_DEPT_CODE,NUM_USER_ID, GSTR_REMARKS, GDT_EFFECTIVE_FRM, GDT_EFFECTIVE_TO, GNUM_ISVALID, GDT_ENTRY_DATE, GNUM_SEAT_ID, GNUM_HOSPITAL_CODE) VALUES (?,?,?,?,?,?,?,?,?,?,?,?,?)
	</QRY>
	</BLOCK>
</OPR>

  <OPR ID="2" NAME="UPDATE" BLOCK_SIZE="2" QRY_TOT_SIZE="2" TRN_MGMT="N">
	<BLOCK ID="1" QRY_SIZE="1" ROWS_INS="S" MANDATORY="Y">
	 <QRY ID="1" COL_SIZE="4">
	 UPDATE FTS_RNI_MST SET GNUM_ISVALID=0, GDT_LSTMOD_DATE=?, GNUM_LSTMOD_SEATID=? WHERE NUM_RNI_ID=? AND GNUM_SLNO=?
	</QRY>
	</BLOCK>
	<BLOCK ID="2" QRY_SIZE="1" ROWS_INS="S" MANDATORY="Y">
	 <QRY ID="1" COL_SIZE="13">
	  INSERT INTO FTS_RNI_MST (NUM_RNI_ID,GNUM_SLNO,STR_RNI_CODE,STR_RNI_NAME,NUM_DEPT_CODE,NUM_USER_ID, GSTR_REMARKS, GDT_EFFECTIVE_FRM, GDT_EFFECTIVE_TO, GNUM_ISVALID, GDT_ENTRY_DATE, GNUM_SEAT_ID, GNUM_HOSPITAL_CODE) VALUES (?,?,?,?,?,?,?,?,?,?,?,?,?)
	</QRY>
	</BLOCK>
</OPR>

<OPR ID="3" NAME="DELETE" BLOCK_SIZE="1" QRY_TOT_SIZE="1" TRN_MGMT="N">
	<BLOCK ID="1" QRY_SIZE="1" ROWS_INS="S" MANDATORY="Y">
	 <QRY ID="1" COL_SIZE="4">
	 UPDATE FTS_RNI_MST SET GNUM_ISVALID=0, GDT_LSTMOD_DATE=?, GNUM_LSTMOD_SEATID=? WHERE NUM_RNI_ID=? AND GNUM_SLNO=?
	</QRY>
	</BLOCK>
</OPR>

</tns:Transaction>