<?xml version="1.0" encoding="UTF-8"?>
<tns:Transaction MODULE_NAME="ESTATE" PROCESS_NAME="buildingMaster" xmlns:tns="http://www.example.org/transactionSchema" xmlns:xsi="http://www.w3.org/2001/XMLSchema-instance" xsi:schemaLocation="http://www.example.org/transactionSchema transactionSchema.xsd ">
<OPR ID="1" NAME="INSERT" BLOCK_SIZE="1" QRY_TOT_SIZE="1" TRN_MGMT="N">
	<BLOCK ID="1" QRY_SIZE="1" ROWS_INS="S" MANDATORY="Y">
	 <QRY ID="1" COL_SIZE="11">
	 INSERT INTO EST_BUILDING_MST (NUM_HOSPITAL_CODE,NUM_BUILDING_CODE,GNUM_SLNO,STR_BUILDING_NAME,NUM_TOT_BLOCK_NUMBER,GDT_EFFECTIVE_FRM,GDT_EFFECTIVE_TO,GNUM_ISVALID,GNUM_SEAT_ID,GDT_ENTRY_DATE,GSTR_REMARKS) VALUES (?,?,?,?,?,?,?,?,?,?,?)
	</QRY>
	</BLOCK>
</OPR>



<OPR ID="2" NAME="UPDATE" BLOCK_SIZE="1" QRY_TOT_SIZE="1" TRN_MGMT="Y">
	<BLOCK ID="1" QRY_SIZE="1" ROWS_INS="S" MANDATORY="Y">
	 <QRY ID="1" COL_SIZE="9">
	 UPDATE EST_BUILDING_MST SET STR_BUILDING_NAME=?, NUM_TOT_BLOCK_NUMBER=?,  GSTR_REMARKS=?, GDT_EFFECTIVE_FRM=?,GDT_EFFECTIVE_TO=?,GNUM_ISVALID=?  WHERE GNUM_SLNO=? AND NUM_BUILDING_CODE=? AND NUM_HOSPITAL_CODE=?
	</QRY>
	</BLOCK>
	
</OPR>

<OPR ID="3" NAME="INSERT" BLOCK_SIZE="3" QRY_TOT_SIZE="3" TRN_MGMT="N">
	
	<BLOCK ID="1" QRY_SIZE="1" ROWS_INS="S" MANDATORY="Y">
	 <QRY ID="1" COL_SIZE="4">
	 UPDATE EST_BUILDING_MST T SET T.GDT_EFFECTIVE_TO=(to_date(?,'DD-MON-YYYY')-1) WHERE T.NUM_BUILDING_CODE=? and T.GNUM_SLNO=? and T.NUM_HOSPITAL_CODE=?
	 </QRY>
	 
	</BLOCK>
	<BLOCK ID="2" QRY_SIZE="1" ROWS_INS="S" MANDATORY="Y">
	 <QRY ID="1" COL_SIZE="14">
	 INSERT INTO EST_BUILDING_MST (NUM_HOSPITAL_CODE,NUM_BUILDING_CODE,GNUM_SLNO,STR_BUILDING_NAME,NUM_TOT_BLOCK_NUMBER,STR_BUILDING_MAP_ID,STR_BUILDING_MAP_LOC,STR_BUILDING_MAP_DESCR,GDT_EFFECTIVE_FRM,GDT_EFFECTIVE_TO,GNUM_ISVALID,GNUM_SEAT_ID,GDT_ENTRY_DATE,GSTR_REMARKS) VALUES (?,?,?,?,?,?,?,?,?,?,?,?,?,?)
	</QRY>
	</BLOCK>
	<BLOCK ID="3" QRY_SIZE="1" ROWS_INS="S" MANDATORY="Y">
	 <QRY ID="1" COL_SIZE="5">
	 UPDATE EST_BUILDING_MST T SET T.GDT_LSTMOD_DATE=?,T.GNUM_LSTMOD_SEATID=?  WHERE T.GNUM_SLNO=? AND T.NUM_BUILDING_CODE=? AND T.NUM_HOSPITAL_CODE=?
	</QRY>
	</BLOCK>
	
</OPR>

<OPR ID="4" NAME="DELETE" BLOCK_SIZE="1" QRY_TOT_SIZE="1" TRN_MGMT="N">
	<BLOCK ID="1" QRY_SIZE="1" ROWS_INS="S" MANDATORY="Y">
	 <QRY ID="1" COL_SIZE="5">
	 UPDATE EST_BUILDING_MST T SET T.GDT_LSTMOD_DATE=?,T.GNUM_LSTMOD_SEATID=?, T.GNUM_ISVALID=0 WHERE T.GNUM_SLNO=? AND T.NUM_BUILDING_CODE=? AND T.NUM_HOSPITAL_CODE=?
	</QRY>
	</BLOCK>
</OPR>

<OPR ID="5" NAME="INSERT" BLOCK_SIZE="2" QRY_TOT_SIZE="2" TRN_MGMT="N">
	<BLOCK ID="1" QRY_SIZE="1" ROWS_INS="S" MANDATORY="Y">
	 <QRY ID="1" COL_SIZE="5">
	 UPDATE EST_BUILDING_MST T SET T.GDT_LSTMOD_DATE=?,T.GNUM_LSTMOD_SEATID=?  WHERE T.GNUM_SLNO=? AND T.NUM_BUILDING_CODE=? AND T.NUM_HOSPITAL_CODE=?
	</QRY>
	</BLOCK>
	<BLOCK ID="2" QRY_SIZE="1" ROWS_INS="S" MANDATORY="Y">
	 <QRY ID="1" COL_SIZE="14">
	 INSERT INTO EST_BUILDING_MST (NUM_HOSPITAL_CODE,NUM_BUILDING_CODE,GNUM_SLNO,STR_BUILDING_NAME,NUM_TOT_BLOCK_NUMBER,STR_BUILDING_MAP_ID,STR_BUILDING_MAP_LOC,STR_BUILDING_MAP_DESCR,GDT_EFFECTIVE_FRM,GDT_EFFECTIVE_TO,GNUM_ISVALID,GNUM_SEAT_ID,GDT_ENTRY_DATE,GSTR_REMARKS) VALUES (?,?,?,?,?,?,?,?,?,?,?,?,?,?)
	</QRY>
	</BLOCK>
	
	
</OPR>

<OPR ID="6" NAME="DELETE" BLOCK_SIZE="2" QRY_TOT_SIZE="2" TRN_MGMT="Y">
 <BLOCK ID="1" QRY_SIZE="1" ROWS_INS="S" MANDATORY="Y">
  <QRY ID="1" COL_SIZE="1">DELETE FROM EST_MAP_MST  WHERE NUM_ID=? and GNUM_ISVALID=1 </QRY> 
  </BLOCK>
  <BLOCK ID="2" QRY_SIZE="1" ROWS_INS="M" MANDATORY="Y">
	 <QRY ID="1" COL_SIZE="8">
	 INSERT INTO EST_MAP_MST (NUM_HOSPITAL_CODE,NUM_ID,GNUM_SLNO,STR_LAND_MAP_LOCATION,STR_LAND_DESC,GNUM_ISVALID,GNUM_SEAT_ID,GDT_ENTRY_DATE) VALUES (?,?,?,?,?,?,?,?)
	</QRY>
	</BLOCK>
 
  </OPR>
  
  
<OPR ID="7" NAME="INSERT" BLOCK_SIZE="1" QRY_TOT_SIZE="1" TRN_MGMT="N">
 <BLOCK ID="1" QRY_SIZE="1" ROWS_INS="S" MANDATORY="Y">
	 <QRY ID="1" COL_SIZE="8">
	 INSERT INTO EST_MAP_MST (NUM_HOSPITAL_CODE,NUM_ID,GNUM_SLNO,STR_LAND_MAP_LOCATION,STR_LAND_DESC,GNUM_ISVALID,GNUM_SEAT_ID,GDT_ENTRY_DATE) VALUES (?,?,?,?,?,?,?,?)
	</QRY>
	</BLOCK>
	 
  </OPR>

</tns:Transaction>