<?xml version="1.0" encoding="UTF-8"?>

<tns:Transaction MODULE_NAME="HOUSEKEEPING" PROCESS_NAME="AreaCleaningMapMaster" xmlns:tns="http://www.example.org/transactionSchema" xmlns:xsi="http://www.w3.org/2001/XMLSchema-instance" xsi:schemaLocation="http://www.example.org/transactionSchema transactionSchema.xsd ">
  <OPR ID="1" NAME="INSERT" BLOCK_SIZE="1" QRY_TOT_SIZE="1" TRN_MGMT="N">
	<BLOCK ID="1" QRY_SIZE="1" ROWS_INS="S" MANDATORY="Y">
	 <QRY ID="1" COL_SIZE="11">
	 INSERT INTO HK_AREA_CLEANING_MAPPING(NUM_HK_AREA_ID, STR_DAY_ID, GNUM_HOSPITAL_CODE, GNUM_ISVALID, GNUM_SEAT_ID, GDT_ENTRY_DATE, HDRNUM_SHIFT_ID, STR_CLEANING_FREQUENCY_ID, NUM_CLEANING_PARAMETER_ID, NUM_SAFETY_PARAMETER_ID, GSTR_REMARKS) VALUES (?,?,?,?,?,?,?,?,?,?,?)
	</QRY>
	</BLOCK>
	
</OPR>

<OPR ID="2" NAME="Update" BLOCK_SIZE="2" QRY_TOT_SIZE="2" TRN_MGMT="Y">
	<BLOCK ID="1" QRY_SIZE="1" ROWS_INS="M" MANDATORY="Y">
	 <QRY ID="1" COL_SIZE="2">
	 DELETE FROM HK_AREA_CLEANING_MAPPING A WHERE A.NUM_HK_AREA_ID=? AND  A.GNUM_HOSPITAL_CODE=?
	</QRY>
	</BLOCK>
	<BLOCK ID="2" QRY_SIZE="1" ROWS_INS="M" MANDATORY="Y">
	 <QRY ID="1" COL_SIZE="11">
	 INSERT INTO HK_AREA_CLEANING_MAPPING(NUM_HK_AREA_ID,  STR_DAY_ID, GNUM_HOSPITAL_CODE, GNUM_ISVALID, GNUM_SEAT_ID, GDT_ENTRY_DATE, HDRNUM_SHIFT_ID, STR_CLEANING_FREQUENCY_ID, NUM_CLEANING_PARAMETER_ID, NUM_SAFETY_PARAMETER_ID, GSTR_REMARKS) VALUES (?,?,?,?,?,?,?,?,?,?,?)
	 </QRY>
	 </BLOCK>
</OPR>

<OPR ID="3" NAME="Delete" BLOCK_SIZE="1" QRY_TOT_SIZE="1" TRN_MGMT="N">
	<BLOCK ID="1" QRY_SIZE="1" ROWS_INS="M" MANDATORY="Y">
	 <QRY ID="1" COL_SIZE="2">
	DELETE FROM HK_AREA_CLEANING_MAPPING A WHERE NUM_HK_AREA_ID=? and GNUM_HOSPITAL_CODE=?
	</QRY>
	</BLOCK>
</OPR>
</tns:Transaction>