<?xml version="1.0" encoding="UTF-8"?>
<tns:Transaction MODULE_NAME="COMITTEE" PROCESS_NAME="ID Card Transaction" xmlns:tns="http://www.example.org/transactionSchema" xmlns:xsi="http://www.w3.org/2001/XMLSchema-instance" xsi:schemaLocation="http://www.example.org/transactionSchema transactionSchema.xsd ">

  <OPR ID="1" NAME="INSERT" BLOCK_SIZE="2" QRY_TOT_SIZE="2" TRN_MGMT="Y">
  <BLOCK ID="1" QRY_SIZE="1" ROWS_INS="S" MANDATORY="Y">
	<QRY ID="1" COL_SIZE="12">
	 INSERT INTO PISCOM_LOST_ICARD_TRN(GNUM_HOSPITAL_CODE,STR_ID_CARD_NUMBER,DT_LOST_DATE,DT_COMPLAIN_DATE,STR_FIR_NO,DT_FIR_DATE,STR_POLICE_STATION,STR_PLACE_WHERE_LOST,GDT_EFFECT_DATE,GDT_ENTRY_DATE,GNUM_ISVALID,GNUM_SEAT_ID) VALUES(?,?,?,?,?,?,?,?,?,?,?,?)
	</QRY>
   </BLOCK>
<BLOCK ID="2" QRY_SIZE="1" ROWS_INS="S" MANDATORY="Y">
	<QRY ID="1" COL_SIZE="4">
	 UPDATE piscom_id_entry_trn SET STR_LOST_FLAG_STATUS=? where STR_ID_CARD_NUMBER=? and STR_LOST_FLAG_STATUS=? and GNUM_HOSPITAL_CODE=?
	</QRY>
   </BLOCK>

</OPR>

<OPR ID="2" NAME="MODIFY" BLOCK_SIZE="1" QRY_TOT_SIZE="1" TRN_MGMT="Y">

   <BLOCK ID="2" QRY_SIZE="1" ROWS_INS="S" MANDATORY="Y">
    <QRY ID="1" COL_SIZE="10">
     UPDATE PISCOM_LOST_ICARD_TRN SET DT_LOST_DATE=?,DT_COMPLAIN_DATE=?,STR_FIR_NO=?,DT_FIR_DATE=?,STR_POLICE_STATION=?,STR_PLACE_WHERE_LOST=?,GDT_LSTMOD_DATE=?,GNUM_LSTMOD_SEATID=? WHERE STR_ID_CARD_NUMBER=? AND GNUM_HOSPITAL_CODE=?
    </QRY>
  </BLOCK>
</OPR>

<OPR ID="3" NAME="delete" BLOCK_SIZE="2" QRY_TOT_SIZE="2" TRN_MGMT="Y">
  <BLOCK ID="1" QRY_SIZE="1" ROWS_INS="S" MANDATORY="Y">
    <QRY ID="1" COL_SIZE="2">
     UPDATE PISCOM_LOST_ICARD_TRN a SET a.gnum_isvalid=0 WHERE a.str_id_card_number=? AND A.GNUM_HOSPITAL_CODE=?   
    </QRY>
   </BLOCK>
   <BLOCK ID="2" QRY_SIZE="1" ROWS_INS="S" MANDATORY="Y">
	<QRY ID="1" COL_SIZE="4">
	 UPDATE piscom_id_entry_trn SET STR_LOST_FLAG_STATUS=? where STR_ID_CARD_NUMBER=? and GNUM_HOSPITAL_CODE=? and STR_LOST_FLAG_STATUS=? 	
	</QRY>
   </BLOCK>
</OPR>



</tns:Transaction>