<?xml version="1.0" encoding="UTF-8"?>
<tns:Transaction MODULE_NAME="BUDGET" PROCESS_NAME="grantTypeMaster" xmlns:tns="http://www.example.org/transactionSchema" xmlns:xsi="http://www.w3.org/2001/XMLSchema-instance" xsi:schemaLocation="http://www.example.org/transactionSchema transactionSchema.xsd ">
  <OPR ID="1" NAME="INSERT" BLOCK_SIZE="1" QRY_TOT_SIZE="1" TRN_MGMT="N">
	<BLOCK ID="1" QRY_SIZE="1" ROWS_INS="S" MANDATORY="Y">
	 <QRY ID="1" COL_SIZE="16">
	 	INSERT INTO ACTCON_DPT_LED_HED_MST(STR_GRANT_TYPE_CODE,NUM_DPT_LED_HED_ID,NUM_DPT_CODE,STR_ADD,STR_OFF_FAX_NO,STR_OFF_PH_NO,STR_MOB_NO,STR_DEPT_LEDGER_CODE,GDT_EFFECTIVE_FRM,GDT_EFFECTIVE_TO,GSTR_REMARKS,GDT_ENTRY_DATE,GNUM_SLNO,GNUM_ISVALID,GNUM_SEAT_ID,GNUM_HOSPITAL_CODE) VALUES (?,?,?,?,?,?,?,?,?,?,?,?,?,?,?,?)
	</QRY>
	</BLOCK>
</OPR>


<OPR ID="2" NAME="UPDATE" BLOCK_SIZE="1" QRY_TOT_SIZE="1" TRN_MGMT="N">
	<BLOCK ID="1" QRY_SIZE="1" ROWS_INS="S" MANDATORY="Y">
	 <QRY ID="1" COL_SIZE="13">
	    UPDATE ACTCON_DPT_LED_HED_MST SET STR_GRANT_TYPE_CODE=?,NUM_DPT_CODE=?,STR_ADD=?,STR_OFF_FAX_NO=?,STR_OFF_PH_NO=?,STR_MOB_NO=?,GDT_EFFECTIVE_FRM=TO_DATE(?,'DD-MON-YYYY'),GDT_EFFECTIVE_TO=TO_DATE(?,'DD-MON-YYYY'),GSTR_REMARKS=? ,GNUM_ISVALID=? WHERE NUM_DPT_LED_HED_ID=? AND GNUM_SLNO=? AND GNUM_HOSPITAL_CODE=?       
		</QRY>
	</BLOCK>
</OPR>

<OPR ID="3" NAME="MODIFICATION" BLOCK_SIZE="2" QRY_TOT_SIZE="2" TRN_MGMT="N">
	<BLOCK ID="1" QRY_SIZE="1" ROWS_INS="S" MANDATORY="Y">
	 <QRY ID="1" COL_SIZE="6">
	  UPDATE ACTCON_DPT_LED_HED_MST T SET T.GDT_EFFECTIVE_TO=(TO_DATE(?,'DD-MON-YYYY')-1),T.GDT_LSTMOD_DATE=(TO_DATE(?,'DD-MON-YYYY')),T.GNUM_LSTMOD_SEATID=? WHERE T.NUM_DPT_LED_HED_ID=? AND T.GNUM_SLNO=? AND T.GNUM_HOSPITAL_CODE=?
	 </QRY>
	 </BLOCK>
	<BLOCK ID="2" QRY_SIZE="1" ROWS_INS="S" MANDATORY="Y">
	<QRY ID="1" COL_SIZE="18">
	 INSERT INTO ACTCON_DPT_LED_HED_MST(NUM_DPT_LED_HED_ID,NUM_DPT_CODE,STR_ADD,STR_OFF_FAX_NO,STR_OFF_PH_NO,STR_MOB_NO,STR_DEPT_LEDGER_CODE,GDT_EFFECTIVE_FRM,GDT_EFFECTIVE_TO,GSTR_REMARKS,GDT_ENTRY_DATE,GNUM_SLNO,GNUM_ISVALID,GDT_LSTMOD_DATE,GNUM_LSTMOD_SEATID,GNUM_SEAT_ID,GNUM_HOSPITAL_CODE,STR_GRANT_TYPE_CODE) VALUES (?,?,?,?,?,?,?,?,?,?,?,?,?,?,?,?,?,?)
	</QRY>
	</BLOCK>
</OPR>

<OPR ID="4" NAME="MODIFICATION" BLOCK_SIZE="2" QRY_TOT_SIZE="2" TRN_MGMT="N">
	<BLOCK ID="1" QRY_SIZE="1" ROWS_INS="S" MANDATORY="Y">
	 <QRY ID="1" COL_SIZE="5">
	  UPDATE ACTCON_DPT_LED_HED_MST T SET T.GDT_LSTMOD_DATE=(TO_DATE(?,'DD-MON-YYYY')),T.GNUM_LSTMOD_SEATID=?  WHERE T.NUM_DPT_LED_HED_ID=? AND T.GNUM_SLNO=? AND T.GNUM_HOSPITAL_CODE=?
	 </QRY>
	 </BLOCK>
	
	<BLOCK ID="2" QRY_SIZE="1" ROWS_INS="S" MANDATORY="Y">
	 <QRY ID="1" COL_SIZE="18">	    				
	 INSERT INTO ACTCON_DPT_LED_HED_MST (NUM_DPT_LED_HED_ID,NUM_DPT_CODE,STR_ADD,STR_OFF_FAX_NO,STR_OFF_PH_NO,STR_MOB_NO,STR_DEPT_LEDGER_CODE,GDT_EFFECTIVE_FRM,GDT_EFFECTIVE_TO,GSTR_REMARKS,GDT_ENTRY_DATE,GNUM_SLNO,GNUM_ISVALID,GDT_LSTMOD_DATE,GNUM_LSTMOD_SEATID,GNUM_SEAT_ID,GNUM_HOSPITAL_CODE,STR_GRANT_TYPE_CODE) VALUES (?,?,?,?,?,?,?,?,?,?,?,?,?,?,?,?,?,?)	
	</QRY>
	</BLOCK>
</OPR>
	
<OPR ID="5" NAME="DELETE" BLOCK_SIZE="1" QRY_TOT_SIZE="1" TRN_MGMT="N">
	<BLOCK ID="1" QRY_SIZE="1" ROWS_INS="S" MANDATORY="Y">
	 <QRY ID="1" COL_SIZE="5">
	  UPDATE ACTCON_DPT_LED_HED_MST T  SET T.GNUM_ISVALID=0,T.GDT_LSTMOD_DATE=(TO_DATE(?,'DD-MON-YYYY')),T.GNUM_LSTMOD_SEATID=? WHERE  T.NUM_DPT_LED_HED_ID= ? AND T.GNUM_SLNO=? AND T.GNUM_HOSPITAL_CODE=?
     </QRY>
   </BLOCK>
</OPR>

		
																							
</tns:Transaction>