<?xml version="1.0" encoding="UTF-8"?>

<tns:Transaction MODULE_NAME="HR" PROCESS_NAME="PaymentOrderGen" xmlns:tns="http://www.example.org/transactionSchema" xmlns:xsi="http://www.w3.org/2001/XMLSchema-instance" xsi:schemaLocation="http://www.example.org/transactionSchema transactionSchema.xsd ">

<OPR ID="1" NAME="INSERT" BLOCK_SIZE="1" QRY_TOT_SIZE="1" TRN_MGMT="N">
<BLOCK ID="1" QRY_SIZE="1" ROWS_INS="S" MANDATORY="Y">
<QRY ID="1" COL_SIZE="17">
INSERT INTO PISLEG_CASE_PO_GEN_TRN (GNUM_HOSPITAL_CODE,STR_CASE_ID, STR_CASE_NUMBER, NUM_DEPT_CODE, NUM_ADV_ID, NUM_COURT_ID, NUM_TOTAL_AMOUNT, STR_PO_ORDER_NUMBER, DT_PO_ORDER_DATE, STR_PO_ORDER_PLACE_BY,  NUM_UPDATION_FLAG,GDT_LSTMOD_DATE, GNUM_LSTMOD_SEATID, GDT_EFFECT_DATE, GDT_ENTRY_DATE, GNUM_ISVALID, GNUM_SEAT_ID) VALUES (?,?,?,?,?,?,?,?,?,?,?,?,?,?,?,?,?)
</QRY>
</BLOCK>
</OPR>


<OPR ID="2" NAME="INSERT" BLOCK_SIZE="1" QRY_TOT_SIZE="1" TRN_MGMT="N">
<BLOCK ID="1" QRY_SIZE="1" ROWS_INS="S" MANDATORY="Y">
<QRY ID="1" COL_SIZE="20">
INSERT INTO PISLEG_CASE_PO_GEN_DTL (GNUM_HOSPITAL_CODE,STR_CASE_ID,STR_CASE_NUMBER,STR_PO_ORDER_NUMBER,DT_PO_ORDER_DATE,DT_FROM_PAYMENT_PERIOD,DT_TO_PAYMENT_PERIOD,STR_TYPE_OF_PAYMENT,NUM_ADV_FEE_CASE_BAS,NUM_ADV_FEE_HEAR_BASIS,NUM_CONF_FEE,DT_OF_CONFERENCE,STR_MISC_EXP,STR_MISC_EXP_AMOUNT,GDT_LSTMOD_DATE,GNUM_LSTMOD_SEATID,GDT_EFFECT_DATE,GDT_ENTRY_DATE,GNUM_ISVALID,GNUM_SEAT_ID) VALUES (?,?,?,?,?,?,?,?,?,?,?,?,?,?,?,?,?,?,?,?)
</QRY>
</BLOCK>
</OPR>


<OPR ID="3" NAME="INSERT" BLOCK_SIZE="2" QRY_TOT_SIZE="2" TRN_MGMT="N">

<BLOCK ID="1" QRY_SIZE="1" ROWS_INS="S" MANDATORY="Y">
<QRY ID="1" COL_SIZE="13">

</QRY>
</BLOCK>

<BLOCK ID="2" QRY_SIZE="1" ROWS_INS="S" MANDATORY="Y">
<QRY ID="1" COL_SIZE="13">

</QRY>
</BLOCK>

</OPR>


<OPR ID="4" NAME="DELETE" BLOCK_SIZE="1" QRY_TOT_SIZE="1" TRN_MGMT="N">
<BLOCK ID="1" QRY_SIZE="1" ROWS_INS="S" MANDATORY="Y">
<QRY ID="1" COL_SIZE="2">
DELETE FROM PISLEG_CASE_PO_GEN_DTL A WHERE STR_PO_ORDER_NUMBER=? and GNUM_HOSPITAL_CODE=? 
</QRY>
</BLOCK>
</OPR>


<OPR ID="5" NAME="UPDATE" BLOCK_SIZE="1" QRY_TOT_SIZE="1" TRN_MGMT="N">
<BLOCK ID="1" QRY_SIZE="1" ROWS_INS="S" MANDATORY="Y">
<QRY ID="1" COL_SIZE="18">

UPDATE PISLEG_CASE_PO_GEN_TRN A SET A.STR_CASE_ID=?, A.STR_CASE_NUMBER=?, A.NUM_DEPT_CODE=?, A.NUM_ADV_ID=?, A.NUM_COURT_ID=?, A.NUM_TOTAL_AMOUNT=?, A.STR_PO_ORDER_NUMBER=?,  A.DT_PO_ORDER_DATE=?, A.STR_PO_ORDER_PLACE_BY=?, A.NUM_UPDATION_FLAG=?, A.GDT_LSTMOD_DATE=?, A.GNUM_LSTMOD_SEATID=?, A.GDT_EFFECT_DATE=?, A.GDT_ENTRY_DATE=?, A.GNUM_ISVALID=?, A.GNUM_SEAT_ID=? WHERE A.STR_PO_ORDER_NUMBER=? and A.GNUM_HOSPITAL_CODE=? 
</QRY>
</BLOCK>
</OPR>


<OPR ID="6" NAME="UPDATE" BLOCK_SIZE="2" QRY_TOT_SIZE="2" TRN_MGMT="N">

<BLOCK ID="1" QRY_SIZE="1" ROWS_INS="S" MANDATORY="Y">
<QRY ID="1" COL_SIZE="2">
UPDATE PISLEG_CASE_PO_GEN_TRN SET GNUM_ISVALID=0 WHERE STR_PO_ORDER_NUMBER=? and GNUM_HOSPITAL_CODE=?  
</QRY>
</BLOCK>

<BLOCK ID="2" QRY_SIZE="1" ROWS_INS="M" MANDATORY="Y">
<QRY ID="1" COL_SIZE="2">
UPDATE PISLEG_CASE_PO_GEN_DTL SET GNUM_ISVALID=0 WHERE STR_PO_ORDER_NUMBER=? and GNUM_HOSPITAL_CODE=?  
</QRY>
</BLOCK>

</OPR>


</tns:Transaction>
