<?xml version="1.0" encoding="UTF-8"?>
<tns:Transaction MODULE_NAME="CANTEEN" PROCESS_NAME="CanteenBillGeneration" xmlns:tns="http://www.example.org/transactionSchema" xmlns:xsi="http://www.w3.org/2001/XMLSchema-instance" xsi:schemaLocation="http://www.example.org/transactionSchema transactionSchema.xsd ">
<OPR ID="1" NAME="INSERT" BLOCK_SIZE="2" QRY_TOT_SIZE="2" TRN_MGMT="Y">
	<BLOCK ID="1" QRY_SIZE="1" ROWS_INS="S" MANDATORY="Y">
	<QRY ID="1" COL_SIZE="19">
	INSERT INTO PISWCA_BILL_GEN_TRN(GNUM_HOSPITAL_CODE,STR_BILL_NUMBER,DT_BILL_DATE,NUM_CANT_CAT_ID,NUM_CANT_ID,STR_INCHARGE_NAME,STR_SALES_MAN,DT_SALES_DATE,STR_SHIFT,DT_DURATION_FROM,DT_DURATION_TO,NUM_TOTAL_AMT,STR_STATUS,GDT_LSTMOD_DATE,GNUM_LSTMOD_SEATID, GDT_EFFECT_DATE,GDT_ENTRY_DATE,GNUM_ISVALID,GNUM_SEAT_ID) VALUES (?,?,?,?,?,?,?,?,?,?,?,?,?,?,?,?,?,?,?)
	</QRY>
	</BLOCK>
	<BLOCK ID="2" QRY_SIZE="1" ROWS_INS="S" MANDATORY="Y">
	<QRY ID="1" COL_SIZE="13">
	INSERT INTO PISWCA_BILL_GEN_DTL(GNUM_HOSPITAL_CODE,STR_BILL_NUMBER,DT_BILL_DATE,NUM_ITEM_ID,NUM_AMOUNT,STR_REMARKS,STR_STATUS,GDT_LSTMOD_DATE,GNUM_LSTMOD_SEATID,GDT_EFFECT_DATE, GDT_ENTRY_DATE,GNUM_ISVALID,GNUM_SEAT_ID) VALUES (?,?,?,?,?,?,?,?,?,?,?,?,?)
	</QRY>
	</BLOCK>
</OPR>

<OPR ID="2" NAME="UPDATE" BLOCK_SIZE="4" QRY_TOT_SIZE="4" TRN_MGMT="N">
	<BLOCK ID="1" QRY_SIZE="1" ROWS_INS="S" MANDATORY="Y">
	<QRY ID="1" COL_SIZE="2">
	DELETE FROM PISWCA_BILL_GEN_TRN WHERE STR_BILL_NUMBER=? AND GNUM_HOSPITAL_CODE=? AND GNUM_ISVALID=1
	</QRY>
	</BLOCK>
	
	<BLOCK ID="2" QRY_SIZE="1" ROWS_INS="S" MANDATORY="Y">
	<QRY ID="1" COL_SIZE="19">
	INSERT INTO PISWCA_BILL_GEN_TRN(GNUM_HOSPITAL_CODE,STR_BILL_NUMBER,DT_BILL_DATE,NUM_CANT_CAT_ID,NUM_CANT_ID,STR_INCHARGE_NAME,STR_SALES_MAN,DT_SALES_DATE,STR_SHIFT,DT_DURATION_FROM,DT_DURATION_TO,NUM_TOTAL_AMT,STR_STATUS,GDT_LSTMOD_DATE,GNUM_LSTMOD_SEATID, GDT_EFFECT_DATE,GDT_ENTRY_DATE,GNUM_ISVALID,GNUM_SEAT_ID) VALUES (?,?,?,?,?,?,?,?,?,?,?,?,?,?,?,?,?,?,?)
	</QRY>
	</BLOCK>
	
	<BLOCK ID="3" QRY_SIZE="1" ROWS_INS="S" MANDATORY="Y">
	<QRY ID="1" COL_SIZE="2">
	DELETE FROM PISWCA_BILL_GEN_DTL WHERE STR_BILL_NUMBER=? AND GNUM_HOSPITAL_CODE=? AND GNUM_ISVALID=1
	</QRY>
	</BLOCK>
	
	<BLOCK ID="4" QRY_SIZE="1" ROWS_INS="S" MANDATORY="Y">
	<QRY ID="1" COL_SIZE="13">
	INSERT INTO PISWCA_BILL_GEN_DTL(GNUM_HOSPITAL_CODE,STR_BILL_NUMBER,DT_BILL_DATE,NUM_ITEM_ID,NUM_AMOUNT,STR_REMARKS,STR_STATUS,GDT_LSTMOD_DATE,GNUM_LSTMOD_SEATID,GDT_EFFECT_DATE, GDT_ENTRY_DATE,GNUM_ISVALID,GNUM_SEAT_ID) VALUES (?,?,?,?,?,?,?,?,?,?,?,?,?)
	</QRY>
	</BLOCK>
</OPR>

<OPR ID="3" NAME="DELETE" BLOCK_SIZE="2" QRY_TOT_SIZE="2" TRN_MGMT="N">
	<BLOCK ID="1" QRY_SIZE="1" ROWS_INS="D" MANDATORY="Y">
	<QRY ID="1" COL_SIZE="2">
	UPDATE PISWCA_BILL_GEN_TRN SET GNUM_ISVALID=0 WHERE STR_BILL_NUMBER=? AND GNUM_HOSPITAL_CODE=? 
	</QRY>
	</BLOCK>
	<BLOCK ID="2" QRY_SIZE="1" ROWS_INS="D" MANDATORY="Y">
	<QRY ID="1" COL_SIZE="2">
	UPDATE PISWCA_BILL_GEN_DTL SET GNUM_ISVALID=0 WHERE STR_BILL_NUMBER=? AND GNUM_HOSPITAL_CODE=?
	</QRY>
	</BLOCK>
</OPR>

</tns:Transaction>
