<tns:Transaction MODULE_NAME="ESTATE" PROCESS_NAME="hospitalbillDetails" xmlns:tns="http://www.example.org/transactionSchema" xmlns:xsi="http://www.w3.org/2001/XMLSchema-instance" xsi:schemaLocation="http://www.example.org/transactionSchema transactionSchema.xsd ">
  <OPR ID="1" NAME="INSERT" BLOCK_SIZE="1" QRY_TOT_SIZE="1" TRN_MGMT="N">
	<BLOCK ID="1" QRY_SIZE="1" ROWS_INS="S" MANDATORY="Y">
	 <QRY ID="1" COL_SIZE="29">
	 INSERT INTO EST_HOSPITAL_BILL_DTL (NUM_HOSPITAL_ID,NUM_BILL_REFERENCE_NO,STR_BILL_NUMBER,STR_EXPENDITURE_HEAD_NAME,STR_ESI_NO,STR_EPF_NO,STR_PAN_NO,NUM_NO_OF_CALLS,NUM_VEHICLE_ID,STR_REQ_SLIP_NO,DT_FUEL_FILLING_DATE,NUM_SUPPLIER_ID,NUM_QUANTITY,NUM_TAX_AMOUNT,STR_SUPPLIER_WORK_ORDER_NO,DT_REPAIR_DATE,DT_PAYMENT_DATE,DT_BILL_FRM_DATE,DT_BILL_TO_DATE,DT_BILL_DUE_DATE,NUM_BILL_AMOUNT,STR_BRIEF_DTL,GDT_EFFECT_DATE,GDT_ENTRY_DATE,GNUM_ISVALID,GBL_NUM_SEAT_ID,STR_BILL_NATURE_NAME,STR_TELEPHONE_NUMBER,NUM_NO_OF_CALLS) VALUES (?,?,?,?,?,?,?,?,?,?,?,?,?,?,?,?,?,?,?,?,?,?,?,?,?,?,?,?,?)
	</QRY>
	</BLOCK>
</OPR>

<OPR ID="2" NAME="UPDATE" BLOCK_SIZE="1" QRY_TOT_SIZE="1" TRN_MGMT="N">
	<BLOCK ID="1" QRY_SIZE="1" ROWS_INS="S" MANDATORY="Y">
	 <QRY ID="1" COL_SIZE="23">
	 UPDATE EST_HOSPITAL_BILL_DTL SET STR_EXPENDITURE_HEAD_NAME=?,STR_ESI_NO=?,STR_EPF_NO=?,STR_PAN_NO=?,NUM_NO_OF_CALLS=?,NUM_VEHICLE_ID=?,STR_REQ_SLIP_NO=?,DT_FUEL_FILLING_DATE=?,NUM_SUPPLIER_ID=?,NUM_QUANTITY=?,NUM_TAX_AMOUNT=?,STR_SUPPLIER_WORK_ORDER_NO=?,DT_REPAIR_DATE=?,DT_PAYMENT_DATE=?,DT_BILL_FRM_DATE=?,DT_BILL_TO_DATE=?,DT_BILL_DUE_DATE=?,NUM_BILL_AMOUNT=?,STR_BRIEF_DTL=?,GDT_EFFECT_DATE=?,GDT_LSTMOD_DATE=?,GDT_LSTMOD_SEATID=? WHERE GNUM_ISVALID=1 AND NUM_BILL_REFERENCE_NO=?
	</QRY>
	</BLOCK>
</OPR>

<OPR ID="3" NAME="DELETE" BLOCK_SIZE="1" QRY_TOT_SIZE="1" TRN_MGMT="N">
	<BLOCK ID="1" QRY_SIZE="1" ROWS_INS="S" MANDATORY="Y">
	 <QRY ID="1" COL_SIZE="1">
	 UPDATE EST_HOSPITAL_BILL_DTL SET GNUM_ISVALID=0 WHERE NUM_BILL_REFERENCE_NO=?
	</QRY>
	</BLOCK>
</OPR>


<OPR ID="4" NAME="UPDATE" BLOCK_SIZE="1" QRY_TOT_SIZE="1" TRN_MGMT="N">
	<BLOCK ID="1" QRY_SIZE="1" ROWS_INS="S" MANDATORY="Y">
	 <QRY ID="1" COL_SIZE="10">
	UPDATE EST_HOSPITAL_BILL_DTL SET STR_INSTRUMENT_TYPE=?,DT_BILL_DUE_DATE=?,STR_INSTRUMENT_NUMBER=?,DT_INSTRUMENT_DATE=?,DT_INSTR_RECEV_DATE=?,STR_BANK_NAME=?,NUM_BILL_AMOUNT_TO_PAID=?,GDT_LSTMOD_DATE=?,GDT_LSTMOD_SEATID=? WHERE GNUM_ISVALID=1 AND NUM_BILL_REFERENCE_NO=?
	</QRY>
	</BLOCK>
</OPR>
</tns:Transaction>