<?xml version="1.0" encoding="UTF-8"?>
<tns:Transaction MODULE_NAME="CANTEEN" PROCESS_NAME="CanteenDietCostPreparation" xmlns:tns="http://www.example.org/transactionSchema" xmlns:xsi="http://www.w3.org/2001/XMLSchema-instance" xsi:schemaLocation="http://www.example.org/transactionSchema transactionSchema.xsd ">
<OPR ID="1" NAME="INSERT" BLOCK_SIZE="2" QRY_TOT_SIZE="2" TRN_MGMT="Y">
	<BLOCK ID="1" QRY_SIZE="1" ROWS_INS="S" MANDATORY="Y">
	<QRY ID="1" COL_SIZE="19">
	INSERT INTO PISWCA_CAN_DIET_PREP_TRN ( GNUM_HOSPITAL_CODE,DT_FOR_PREPARATION ,NUM_CANT_ID, NUM_DIET_NO ,STR_SHIFT,NUM_ITEM_ID, NUM_ITEM_QTY,NUM_UNIT_ID,NUM_TOTAL_COST,NUM_COST_PER_UNIT,NUM_COST_FOR_SALE, STR_STATUS, GDT_LSTMOD_DATE, GNUM_LSTMOD_SEATID,GDT_EFFECT_DATE,GDT_ENTRY_DATE,GNUM_ISVALID,GNUM_SEAT_ID,NUM_FINAL_TOTAL_COST) VALUES (?,?,?,?,?,?,?,?,?,?,?,?,?,?,?,?,?,?,?)
	</QRY>
	</BLOCK>
	<BLOCK ID="2" QRY_SIZE="1" ROWS_INS="S" MANDATORY="Y">
	<QRY ID="1" COL_SIZE="15">
	INSERT INTO PISWCA_CAN_DIET_PREP_DTL (GNUM_HOSPITAL_CODE,DT_FOR_PREPARATION,NUM_CANT_ID,NUM_DIET_NO,NUM_ITEM_ID,NUM_INGREDIENT_ITEM_ID,NUM_QTY,NUM_COST,STR_STATUS,GDT_LSTMOD_DATE,GNUM_LSTMOD_SEATID,GDT_EFFECT_DATE, GDT_ENTRY_DATE,GNUM_ISVALID,GNUM_SEAT_ID) VALUES (?,?,?,?,?,?,?,?,?,?,?,?,?,?,?)
	</QRY>
	</BLOCK>
</OPR>

<OPR ID="2" NAME="UPDATE" BLOCK_SIZE="1" QRY_TOT_SIZE="1" TRN_MGMT="N">
<BLOCK ID="1" QRY_SIZE="1" ROWS_INS="S" MANDATORY="Y">
<QRY ID="1" COL_SIZE="5">
UPDATE PISWCA_CAN_DIET_PREP_TRN SET NUM_COST_FOR_SALE=? ,GDT_LSTMOD_DATE=?, GNUM_LSTMOD_SEATID=? WHERE NUM_DIET_NO=? AND GNUM_HOSPITAL_CODE=? AND GNUM_ISVALID=1
</QRY>
</BLOCK>
</OPR>

<OPR ID="3" NAME="DELETE" BLOCK_SIZE="2" QRY_TOT_SIZE="2" TRN_MGMT="N">
	<BLOCK ID="1" QRY_SIZE="1" ROWS_INS="D" MANDATORY="Y">
	<QRY ID="1" COL_SIZE="2">
	UPDATE PISWCA_CAN_DIET_PREP_TRN SET GNUM_ISVALID=0 WHERE NUM_DIET_NO=? AND GNUM_HOSPITAL_CODE=?
	</QRY>
	</BLOCK>
	<BLOCK ID="2" QRY_SIZE="1" ROWS_INS="D" MANDATORY="Y">
	<QRY ID="1" COL_SIZE="2">
	UPDATE PISWCA_CAN_DIET_PREP_DTL SET GNUM_ISVALID=0 WHERE NUM_DIET_NO=? AND GNUM_HOSPITAL_CODE=?
	</QRY>
	</BLOCK>
</OPR>



<OPR ID="4" NAME="DELETE" BLOCK_SIZE="2" QRY_TOT_SIZE="2" TRN_MGMT="N">
	<BLOCK ID="1" QRY_SIZE="1" ROWS_INS="D" MANDATORY="Y">
	<QRY ID="1" COL_SIZE="2">
	DELETE FROM PISWCA_CAN_DIET_PREP_TRN WHERE NUM_DIET_NO=? AND GNUM_HOSPITAL_CODE=?
	</QRY>
	</BLOCK>
	<BLOCK ID="2" QRY_SIZE="1" ROWS_INS="D" MANDATORY="Y">
	<QRY ID="1" COL_SIZE="2">
	DELETE FROM PISWCA_CAN_DIET_PREP_DTL WHERE NUM_DIET_NO=? AND GNUM_HOSPITAL_CODE=?
	</QRY>
	</BLOCK>
</OPR>





</tns:Transaction>
