<?xml version="1.0" encoding="UTF-8"?>
<tns:Transaction MODULE_NAME="FTS" PROCESS_NAME="DenominationMaster" xmlns:tns="http://www.example.org/transactionSchema" xmlns:xsi="http://www.w3.org/2001/XMLSchema-instance" xsi:schemaLocation="http://www.example.org/transactionSchema transactionSchema.xsd ">
<OPR ID="1" NAME="INSERT" BLOCK_SIZE="1" QRY_TOT_SIZE="1" TRN_MGMT="N">
	<BLOCK ID="1" QRY_SIZE="1" ROWS_INS="S" MANDATORY="Y">
	 <QRY ID="1" COL_SIZE="11">
	 INSERT INTO FTS_DENOMINATION_MST(NUM_DENOMINATION_ID,STR_DENOMINATION_TYPE,NUM_ALERT_AMOUNT_LESS,GNUM_SLNO,GDT_EFFECTIVE_FRM,GDT_EFFECTIVE_TO,GSTR_REMARKS,GDT_ENTRY_DATE,GNUM_ISVALID,GNUM_SEAT_ID,GNUM_HOSPITAL_CODE) VALUES (?,?,?,?,?,?,?,?,?,?,?)
	</QRY>
	</BLOCK>
</OPR>
<OPR ID="2" NAME="UPDATE" BLOCK_SIZE="1" QRY_TOT_SIZE="1" TRN_MGMT="N">
	<BLOCK ID="1" QRY_SIZE="1" ROWS_INS="S" MANDATORY="Y">
	 <QRY ID="1" COL_SIZE="11">
	 UPDATE FTS_DENOMINATION_MST SET STR_DENOMINATION_TYPE=?,NUM_ALERT_AMOUNT_LESS=?,GDT_EFFECTIVE_FRM=?,GDT_EFFECTIVE_TO=?,GSTR_REMARKS=?,GNUM_ISVALID=?,GDT_LSTMOD_DATE=?,GNUM_LSTMOD_SEATID=? WHERE NUM_DENOMINATION_ID=? AND GNUM_SLNO=? and GNUM_HOSPITAL_CODE=?
	</QRY>
	</BLOCK>
</OPR>
<OPR ID="3" NAME="MODIFY" BLOCK_SIZE="2" QRY_TOT_SIZE="2" TRN_MGMT="N">
	<BLOCK ID="1" QRY_SIZE="1" ROWS_INS="S" MANDATORY="Y">
	 <QRY ID="1" COL_SIZE="6">
	 UPDATE FTS_DENOMINATION_MST T SET T.GDT_LSTMOD_DATE=?,T.GNUM_LSTMOD_SEATID=?,T.GDT_EFFECTIVE_TO=(TO_DATE(?,'DD-MON-YYYY')-1) WHERE  T.NUM_DENOMINATION_ID=?  and T.GNUM_SLNO=? AND gnum_hospital_code=?
	 </QRY>
	 </BLOCK>
		
	<BLOCK ID="2" QRY_SIZE="1" ROWS_INS="S" MANDATORY="Y">
	 <QRY ID="1" COL_SIZE="11">
	 INSERT INTO FTS_DENOMINATION_MST(gnum_hospital_code,NUM_DENOMINATION_ID,GNUM_SLNO,STR_DENOMINATION_TYPE,NUM_ALERT_AMOUNT_LESS,GDT_EFFECTIVE_FRM,GDT_EFFECTIVE_TO,GNUM_ISVALID,GNUM_SEAT_ID,GDT_ENTRY_DATE,GSTR_REMARKS) VALUES (?,?,?,?,?,?,?,?,?,?,?)
	</QRY>
	</BLOCK>		
</OPR>
<OPR ID="4" NAME="DELETE" BLOCK_SIZE="1" QRY_TOT_SIZE="1" TRN_MGMT="N">
	<BLOCK ID="1" QRY_SIZE="1" ROWS_INS="S" MANDATORY="Y">
	 <QRY ID="1" COL_SIZE="5">
	 UPDATE FTS_DENOMINATION_MST SET GDT_LSTMOD_DATE=?,GNUM_LSTMOD_SEATID=?,GNUM_ISVALID=0 WHERE NUM_DENOMINATION_ID=? AND GNUM_SLNO=? AND gnum_hospital_code=?
	</QRY>
	</BLOCK>
</OPR>
<OPR ID="6" NAME="MODIFICATION" BLOCK_SIZE="2" QRY_TOT_SIZE="2" TRN_MGMT="N">
  <BLOCK ID="1" QRY_SIZE="1" ROWS_INS="S" MANDATORY="Y">
	<QRY ID="1" COL_SIZE="11">
	INSERT INTO FTS_DENOMINATION_MST(gnum_hospital_code,NUM_DENOMINATION_ID,GNUM_SLNO,STR_DENOMINATION_TYPE,NUM_ALERT_AMOUNT_LESS,GDT_EFFECTIVE_FRM,GDT_EFFECTIVE_TO,GNUM_ISVALID,GNUM_SEAT_ID,GDT_ENTRY_DATE,GSTR_REMARKS) VALUES (?,?,?,?,?,?,?,?,?,?,?)
	</QRY>
   </BLOCK>
   <BLOCK ID="2" QRY_SIZE="1" ROWS_INS="S" MANDATORY="Y">
	 <QRY ID="1" COL_SIZE="5">
	 UPDATE FTS_DENOMINATION_MST T SET T.GDT_LSTMOD_DATE=?,T.GNUM_LSTMOD_SEATID=? WHERE T.NUM_DENOMINATION_ID=? AND T.GNUM_SLNO=? AND T.gnum_hospital_code=?
	 </QRY>
	</BLOCK>
</OPR>
<OPR ID="7" NAME="MODIFICATION" BLOCK_SIZE="1" QRY_TOT_SIZE="1" TRN_MGMT="N">
  <BLOCK ID="1" QRY_SIZE="1" ROWS_INS="S" MANDATORY="Y">
	<QRY ID="1" COL_SIZE="10">
	INSERT INTO FTS_DENOMINATION_MST(NUM_DENOMINATION_ID,GNUM_SLNO,STR_DENOMINATION_TYPE,NUM_ALERT_AMOUNT_LESS,GDT_EFFECTIVE_FRM,GDT_EFFECTIVE_TO,GSTR_REMARKS,GNUM_ISVALID,GDT_LSTMOD_DATE,GNUM_LSTMOD_SEATID) VALUES (?,?,?,?,?,?,?,?,?,?)
	</QRY>
   </BLOCK>
</OPR>
</tns:Transaction>