<?xml version="1.0" encoding="UTF-8"?>
<tns:Transaction MODULE_NAME="PAYROLL" PROCESS_NAME="DPMaster" xmlns:tns="http://www.example.org/transactionSchema" xmlns:xsi="http://www.w3.org/2001/XMLSchema-instance" xsi:schemaLocation="http://www.example.org/transactionSchema transactionSchema.xsd ">
<OPR ID="1" NAME="INSERT" BLOCK_SIZE="1" QRY_TOT_SIZE="1" TRN_MGMT="N">
	<BLOCK ID="1" QRY_SIZE="1" ROWS_INS="S" MANDATORY="Y">
	 <QRY ID="1" COL_SIZE="14">
	 INSERT INTO ACTPAY_DED_PRI_MST (STR_DEDUCTION_CODE,STR_DEDUCTION_TYPE,NUM_DED_PRIORITY,GDT_EFFECTIVE_FRM,GDT_EFFECTIVE_TO,GNUM_ISVALID, GNUM_SEAT_ID, GDT_ENTRY_DATE, GDT_LSTMOD_DATE, GNUM_LSTMOD_SEATID, GSTR_REMARKS,GNUM_SLNO,NUM_DEDUCTION_PRI_ID,GNUM_HOSPITAL_CODE) VALUES (?,?,?,?,?,?,?,?,?,?,?,?,?,?)
	</QRY>
	</BLOCK>
</OPR>

<OPR ID="2" NAME="UPDATE" BLOCK_SIZE="1" QRY_TOT_SIZE="1" TRN_MGMT="N">
	<BLOCK ID="1" QRY_SIZE="1" ROWS_INS="S" MANDATORY="Y">
	 <QRY ID="1" COL_SIZE="13">
	 UPDATE  ACTPAY_DED_PRI_MST  SET STR_DEDUCTION_CODE=?,STR_DEDUCTION_TYPE=?,NUM_DED_PRIORITY=?,GDT_EFFECTIVE_FRM=TO_DATE(?,'DD-MON-YYYY'),GDT_EFFECTIVE_TO=TO_DATE(?,'DD-MON-YYYY'),GNUM_ISVALID=?,GNUM_SEAT_ID=?,GDT_ENTRY_DATE=?,GSTR_REMARKS=? ,GNUM_HOSPITAL_CODE=? WHERE  GNUM_SLNO=? AND NUM_DEDUCTION_PRI_ID=? AND GNUM_HOSPITAL_CODE=?
	 </QRY>
	</BLOCK>
</OPR>

<OPR ID="4" NAME="MODIFICATION" BLOCK_SIZE="2" QRY_TOT_SIZE="2" TRN_MGMT="N">
	<BLOCK ID="1" QRY_SIZE="1" ROWS_INS="S" MANDATORY="Y">
	 <QRY ID="1" COL_SIZE="6">
	   UPDATE ACTPAY_DED_PRI_MST T SET GDT_EFFECTIVE_TO=(TO_DATE(?,'DD-MON-YYYY')-1),GDT_LSTMOD_DATE=(TO_DATE(?,'DD-MON-YYYY')),GNUM_LSTMOD_SEATID=? WHERE T.NUM_DEDUCTION_PRI_ID=? AND T.GNUM_SLNO=? AND T.GNUM_HOSPITAL_CODE=?
	 </QRY>
	 </BLOCK>
	<BLOCK ID="2" QRY_SIZE="1" ROWS_INS="S" MANDATORY="Y">
	 <QRY ID="1" COL_SIZE="12">
	 INSERT INTO ACTPAY_DED_PRI_MST  (STR_DEDUCTION_CODE,STR_DEDUCTION_TYPE,NUM_DED_PRIORITY,GDT_EFFECTIVE_FRM,GDT_EFFECTIVE_TO,GNUM_ISVALID, GDT_ENTRY_DATE, GNUM_SEAT_ID, GSTR_REMARKS, GNUM_SLNO, NUM_DEDUCTION_PRI_ID,GNUM_HOSPITAL_CODE) VALUES (?,?,?,?,?,?,?,?,?,?,?,?)
	</QRY>
	</BLOCK>
</OPR>
<OPR ID="5" NAME="MODIFICATION" BLOCK_SIZE="2" QRY_TOT_SIZE="2" TRN_MGMT="N">
	<BLOCK ID="1" QRY_SIZE="1" ROWS_INS="S" MANDATORY="Y">
	 <QRY ID="1" COL_SIZE="5">
	   UPDATE ACTPAY_DED_PRI_MST T SET GDT_LSTMOD_DATE=(TO_DATE(?,'DD-MON-YYYY')),GNUM_LSTMOD_SEATID=? WHERE T.NUM_DEDUCTION_PRI_ID=? AND T.GNUM_SLNO=? AND T.GNUM_HOSPITAL_CODE=?
	 </QRY>
	 </BLOCK>
	<BLOCK ID="2" QRY_SIZE="1" ROWS_INS="S" MANDATORY="Y">
	 <QRY ID="1" COL_SIZE="12">
	 INSERT INTO ACTPAY_DED_PRI_MST  (STR_DEDUCTION_CODE,STR_DEDUCTION_TYPE,NUM_DED_PRIORITY,GDT_EFFECTIVE_FRM,GDT_EFFECTIVE_TO,GNUM_ISVALID, GDT_ENTRY_DATE, GNUM_SEAT_ID, GSTR_REMARKS, GNUM_SLNO, NUM_DEDUCTION_PRI_ID,GNUM_HOSPITAL_CODE) VALUES (?,?,?,?,?,?,?,?,?,?,?,?)
	</QRY>
	</BLOCK>
</OPR>
<OPR ID="6" NAME="DELETE" BLOCK_SIZE="1" QRY_TOT_SIZE="1" TRN_MGMT="N">
	<BLOCK ID="1" QRY_SIZE="1" ROWS_INS="S" MANDATORY="Y">
	 <QRY ID="1" COL_SIZE="5">
	  UPDATE ACTPAY_DED_PRI_MST T  SET T.GNUM_ISVALID=0,GDT_LSTMOD_DATE=(TO_DATE(?,'DD-MON-YYYY')),GNUM_LSTMOD_SEATID=? WHERE  T.NUM_DEDUCTION_PRI_ID=? AND T.GNUM_SLNO=? AND T.GNUM_HOSPITAL_CODE=?
     </QRY>
   </BLOCK>
</OPR>

</tns:Transaction>
