<?xml version="1.0" encoding="UTF-8"?>
<tns:Transaction MODULE_NAME="ESTATE" PROCESS_NAME="complaintcategoryMaster" xmlns:tns="http://www.example.org/transactionSchema" xmlns:xsi="http://www.w3.org/2001/XMLSchema-instance" xsi:schemaLocation="http://www.example.org/transactionSchema transactionSchema.xsd ">
  <OPR ID="1" NAME="INSERT" BLOCK_SIZE="1" QRY_TOT_SIZE="1" TRN_MGMT="N">
	<BLOCK ID="1" QRY_SIZE="1" ROWS_INS="S" MANDATORY="Y">
	 <QRY ID="1" COL_SIZE="10">
	 INSERT INTO EST_COMPLAINT_CAT_MST (NUM_HOSPITAL_CODE, NUM_COMPLAIN_CATEGORY_ID, GNUM_SLNO, STR_COMPLAIN_CATEGORY_NAME, GDT_EFFECTIVE_FRM, GDT_EFFECTIVE_TO, GNUM_ISVALID, GNUM_SEAT_ID, GDT_ENTRY_DATE,  GSTR_REMARKS) VALUES (?,?,?,?,?,?,?,?,?,?)
	</QRY>
	</BLOCK>
</OPR>

<OPR ID="2" NAME="UPDATE" BLOCK_SIZE="1" QRY_TOT_SIZE="1" TRN_MGMT="N">
	<BLOCK ID="1" QRY_SIZE="1" ROWS_INS="S" MANDATORY="Y">
	 <QRY ID="1" COL_SIZE="8">
	 UPDATE EST_COMPLAINT_CAT_MST SET STR_COMPLAIN_CATEGORY_NAME=?,GNUM_ISVALID=?, GDT_EFFECTIVE_FRM=TO_DATE(?,'DD-MON-YYYY'),GDT_EFFECTIVE_TO=TO_DATE(?,'DD-MON-YYYY'),GSTR_REMARKS=? WHERE NUM_COMPLAIN_CATEGORY_ID=? AND GNUM_SLNO=? AND NUM_HOSPITAL_CODE=?
	</QRY>
	</BLOCK>
</OPR>

<OPR ID="3" NAME="MODIFICATION" BLOCK_SIZE="2" QRY_TOT_SIZE="2" TRN_MGMT="N">
	<BLOCK ID="1" QRY_SIZE="1" ROWS_INS="S" MANDATORY="Y">
	 <QRY ID="1" COL_SIZE="3">
	  UPDATE EST_COMPLAINT_CAT_MST T SET T.GDT_EFFECTIVE_TO=(TO_DATE(?,'DD-MON-YYYY')-1) WHERE T.NUM_COMPLAIN_CATEGORY_ID=? AND T.GNUM_SLNO=?
	 </QRY>
	 </BLOCK>
	<BLOCK ID="2" QRY_SIZE="1" ROWS_INS="S" MANDATORY="Y">
	 <QRY ID="1" COL_SIZE="12">
	 INSERT INTO EST_COMPLAINT_CAT_MST (NUM_HOSPITAL_CODE, NUM_COMPLAIN_CATEGORY_ID, GNUM_SLNO, STR_COMPLAIN_CATEGORY_NAME, GDT_EFFECTIVE_FRM, GDT_EFFECTIVE_TO, GNUM_ISVALID, GNUM_SEAT_ID, GDT_ENTRY_DATE, GDT_LSTMOD_DATE, GNUM_LSTMOD_SEATID,  GSTR_REMARKS) VALUES (?,?,?,?,?,?,?,?,?,?,?,?)
	</QRY>
	</BLOCK>
</OPR>

<OPR ID="4" NAME="DELETE" BLOCK_SIZE="1" QRY_TOT_SIZE="1" TRN_MGMT="N">
	<BLOCK ID="1" QRY_SIZE="1" ROWS_INS="S" MANDATORY="Y">
	 <QRY ID="1" COL_SIZE="5">
	  UPDATE EST_COMPLAINT_CAT_MST T  SET T.GDT_LSTMOD_DATE=?,T.GNUM_LSTMOD_SEATID=?,  T.GNUM_ISVALID=0 WHERE  T.NUM_COMPLAIN_CATEGORY_ID=? AND T.GNUM_SLNO=? AND T.NUM_HOSPITAL_CODE=?
     </QRY>
   </BLOCK>
</OPR>

<OPR ID="5" NAME="UPDATE" BLOCK_SIZE="1" QRY_TOT_SIZE="1" TRN_MGMT="N">
	<BLOCK ID="1" QRY_SIZE="1" ROWS_INS="S" MANDATORY="Y">
	 <QRY ID="1" COL_SIZE="7">
	 UPDATE EST_COMPLAINT_CAT_MST SET STR_COMPLAIN_CATEGORY_NAME=?,GNUM_ISVALID=?, GDT_EFFECTIVE_FRM=?,GSTR_REMARKS=? WHERE NUM_COMPLAIN_CATEGORY_ID=? AND GNUM_SLNO=? AND NUM_HOSPITAL_CODE=?
	</QRY>
	</BLOCK>
</OPR>

<OPR ID="6" NAME="MODIFY" BLOCK_SIZE="3" QRY_TOT_SIZE="3" TRN_MGMT="N">
	<BLOCK ID="1" QRY_SIZE="1" ROWS_INS="S" MANDATORY="Y">
	 <QRY ID="1" COL_SIZE="4">
	  UPDATE EST_COMPLAINT_CAT_MST T SET T.GDT_EFFECTIVE_TO=(TO_DATE(?,'DD-MON-YYYY')-1) WHERE T.NUM_COMPLAIN_CATEGORY_ID=? AND T.GNUM_SLNO=? AND T.NUM_HOSPITAL_CODE=?
	 </QRY>
	 </BLOCK>
	<BLOCK ID="2" QRY_SIZE="1" ROWS_INS="S" MANDATORY="Y">
	 <QRY ID="1" COL_SIZE="10">
	  INSERT INTO EST_COMPLAINT_CAT_MST (NUM_HOSPITAL_CODE, NUM_COMPLAIN_CATEGORY_ID, GNUM_SLNO, STR_COMPLAIN_CATEGORY_NAME, GDT_EFFECTIVE_FRM, GDT_EFFECTIVE_TO, GNUM_ISVALID, GNUM_SEAT_ID, GDT_ENTRY_DATE,  GSTR_REMARKS) VALUES (?,?,?,?,?,?,?,?,?,?)
	</QRY>
	</BLOCK>
	<BLOCK ID="3" QRY_SIZE="1" ROWS_INS="S" MANDATORY="Y">
	<QRY ID="1" COL_SIZE="5">
	  UPDATE EST_COMPLAINT_CAT_MST T SET  T.GDT_LSTMOD_DATE=(TO_DATE(?,'DD-MON-YYYY')), T.GNUM_LSTMOD_SEATID=? WHERE T.NUM_COMPLAIN_CATEGORY_ID=? AND T.GNUM_SLNO=? AND T.NUM_HOSPITAL_CODE=?
	 </QRY>
	 </BLOCK>
</OPR>

<OPR ID="7" NAME="MODIFYNEXT" BLOCK_SIZE="2" QRY_TOT_SIZE="2" TRN_MGMT="N">
	<BLOCK ID="1" QRY_SIZE="1" ROWS_INS="S" MANDATORY="Y">
	<QRY ID="1" COL_SIZE="5">
	  UPDATE EST_COMPLAINT_CAT_MST T SET  T.GDT_LSTMOD_DATE=?, T.GNUM_LSTMOD_SEATID=? WHERE T.NUM_COMPLAIN_CATEGORY_ID=? AND T.GNUM_SLNO=? AND T.NUM_HOSPITAL_CODE=?
	 </QRY>
	 </BLOCK>
	<BLOCK ID="2" QRY_SIZE="1" ROWS_INS="S" MANDATORY="Y">
	<QRY ID="1" COL_SIZE="10">
	 INSERT INTO EST_COMPLAINT_CAT_MST (NUM_HOSPITAL_CODE, NUM_COMPLAIN_CATEGORY_ID, GNUM_SLNO, STR_COMPLAIN_CATEGORY_NAME, GDT_EFFECTIVE_FRM, GDT_EFFECTIVE_TO, GNUM_ISVALID, GNUM_SEAT_ID, GDT_ENTRY_DATE,  GSTR_REMARKS) VALUES (?,?,?,?,?,?,?,?,?,?)
	</QRY>
	</BLOCK>
</OPR>

</tns:Transaction>