<?xml version="1.0" encoding="UTF-8"?>
<tns:Transaction MODULE_NAME="Hr" PROCESS_NAME="Ingrident Master" xmlns:tns="http://www.example.org/transactionSchema" xmlns:xsi="http://www.w3.org/2001/XMLSchema-instance" xsi:schemaLocation="http://www.example.org/transactionSchema transactionSchema.xsd ">
  <OPR ID="1" NAME="INSERT" BLOCK_SIZE="2" QRY_TOT_SIZE="2" TRN_MGMT="Y">
	<BLOCK ID="1" QRY_SIZE="1" ROWS_INS="S" MANDATORY="Y">
	 <QRY ID="1" COL_SIZE="10">
	 INSERT INTO PISWCA_CANTEEN_ITEM_INGD1_MST (GNUM_HOSPITAL_CODE,NUM_IT_ING_STORE_ID, NUM_ITEM_ID,GNUM_SLNO, GDT_EFFECTIVE_FRM, GDT_EFFECTIVE_TO, GNUM_ISVALID, GNUM_SEAT_ID,GDT_ENTRY_DATE, GSTR_REMARKS) VALUES (?,?,?,?,?,?,?,?,?,?)
	</QRY>
	</BLOCK>
	<BLOCK ID="2" QRY_SIZE="1" ROWS_INS="M" MANDATORY="Y">
	<QRY ID="1" COL_SIZE="11">
	 INSERT INTO PISWCA_CANTEEN_ITEM_INGD2_MST (GNUM_HOSPITAL_CODE,NUM_IT_ING_STORE_ID,NUM_ITEM_ID,NUM_IT_ING_ID,GNUM_SLNO,GDT_EFFECTIVE_FRM,GDT_EFFECTIVE_TO,GDT_ENTRY_DATE,GNUM_ISVALID,GNUM_SEAT_ID,GSTR_REMARKS) VALUES (?,?,?,?,?,?,?,?,?,?,?)
	 </QRY>
   </BLOCK>

</OPR>
 
<OPR ID="2" NAME="UPDATE" BLOCK_SIZE="3" QRY_TOT_SIZE="3" TRN_MGMT="Y">
	 <BLOCK ID="1" QRY_SIZE="1" ROWS_INS="S" MANDATORY="Y">
	 <QRY ID="1" COL_SIZE="3">
	 DELETE FROM PISWCA_CANTEEN_ITEM_INGD2_MST A WHERE  A.NUM_IT_ING_STORE_ID=? AND A.GNUM_SLNO=? AND A.GNUM_HOSPITAL_CODE=?
	</QRY>
	</BLOCK>	
	<BLOCK ID="2" QRY_SIZE="1" ROWS_INS="S" MANDATORY="Y">
	 <QRY ID="1" COL_SIZE="9">
	  UPDATE PISWCA_CANTEEN_ITEM_INGD1_MST SET NUM_ITEM_ID=?,GDT_EFFECTIVE_FRM=?,GDT_EFFECTIVE_TO=?,GNUM_ISVALID=?,GSTR_REMARKS=?,GDT_ENTRY_DATE=? WHERE NUM_IT_ING_STORE_ID=? AND GNUM_SLNO=? AND GNUM_HOSPITAL_CODE=?
	 </QRY>
	</BLOCK>
	<BLOCK ID="3" QRY_SIZE="1" ROWS_INS="M" MANDATORY="Y">
	<QRY ID="1" COL_SIZE="11">
	 INSERT INTO PISWCA_CANTEEN_ITEM_INGD2_MST (GNUM_HOSPITAL_CODE,NUM_IT_ING_STORE_ID,NUM_ITEM_ID,NUM_IT_ING_ID,GNUM_SLNO,GDT_EFFECTIVE_FRM,GDT_EFFECTIVE_TO,GDT_ENTRY_DATE,GNUM_ISVALID,GNUM_SEAT_ID,GSTR_REMARKS) VALUES (?,?,?,?,?,?,?,?,?,?,?)
	 </QRY>
   </BLOCK>
	
</OPR>

<OPR ID="3" NAME="MODIFICATION1" BLOCK_SIZE="4" QRY_TOT_SIZE="4" TRN_MGMT="Y">
			
	<BLOCK ID="1" QRY_SIZE="1" ROWS_INS="S" MANDATORY="Y">
	 <QRY ID="1" COL_SIZE="6">
	 UPDATE PISWCA_CANTEEN_ITEM_INGD1_MST T SET T.GDT_EFFECTIVE_TO=(TO_DATE(?,'DD-MON-YYYY')-1),T.GDT_LSTMOD_DATE=?, T.GNUM_LSTMOD_SEATID=? WHERE  T.NUM_IT_ING_STORE_ID=? and T.GNUM_SLNO=? AND T.GNUM_HOSPITAL_CODE=?
	</QRY>
	</BLOCK>
	<BLOCK ID="2" QRY_SIZE="1" ROWS_INS="S" MANDATORY="Y">
	 <QRY ID="1" COL_SIZE="6">
	 UPDATE PISWCA_CANTEEN_ITEM_INGD2_MST T SET T.GDT_EFFECTIVE_TO=(TO_DATE(?,'DD-MON-YYYY')-1),T.GDT_LSTMOD_DATE=?, T.GNUM_LSTMOD_SEATID=? WHERE  T.NUM_IT_ING_STORE_ID=? and T.GNUM_SLNO=? AND T.GNUM_HOSPITAL_CODE=?
	</QRY>
	</BLOCK>
	<BLOCK ID="3" QRY_SIZE="1" ROWS_INS="S" MANDATORY="Y">
	 <QRY ID="1" COL_SIZE="10">
	 INSERT INTO PISWCA_CANTEEN_ITEM_INGD1_MST (GNUM_HOSPITAL_CODE,NUM_IT_ING_STORE_ID, NUM_ITEM_ID,GNUM_SLNO, GDT_EFFECTIVE_FRM, GDT_EFFECTIVE_TO, GNUM_ISVALID, GNUM_SEAT_ID,GDT_ENTRY_DATE, GSTR_REMARKS) VALUES (?,?,?,?,?,?,?,?,?,?)
	 </QRY>
	</BLOCK>
	<BLOCK ID="4" QRY_SIZE="1" ROWS_INS="M" MANDATORY="Y">
	<QRY ID="1" COL_SIZE="11">
	 INSERT INTO PISWCA_CANTEEN_ITEM_INGD2_MST (GNUM_HOSPITAL_CODE,NUM_IT_ING_STORE_ID,NUM_ITEM_ID,NUM_IT_ING_ID,GNUM_SLNO,GDT_EFFECTIVE_FRM,GDT_EFFECTIVE_TO,GDT_ENTRY_DATE,GNUM_ISVALID,GNUM_SEAT_ID,GSTR_REMARKS) VALUES (?,?,?,?,?,?,?,?,?,?,?)
	 </QRY>
   </BLOCK>
  
</OPR>
 
<OPR ID="4" NAME="MODIFICATION2" BLOCK_SIZE="4" QRY_TOT_SIZE="4" TRN_MGMT="Y">
	<BLOCK ID="1" QRY_SIZE="1" ROWS_INS="S" MANDATORY="Y">
	<QRY ID="1" COL_SIZE="10">
	 INSERT INTO PISWCA_CANTEEN_ITEM_INGD1_MST (GNUM_HOSPITAL_CODE,NUM_IT_ING_STORE_ID, NUM_ITEM_ID,GNUM_SLNO, GDT_EFFECTIVE_FRM, GDT_EFFECTIVE_TO, GNUM_ISVALID, GNUM_SEAT_ID,GDT_ENTRY_DATE, GSTR_REMARKS) VALUES (?,?,?,?,?,?,?,?,?,?)
	 </QRY>
	</BLOCK>
	<BLOCK ID="2" QRY_SIZE="1" ROWS_INS="M" MANDATORY="Y">
	<QRY ID="1" COL_SIZE="11">
	 INSERT INTO PISWCA_CANTEEN_ITEM_INGD2_MST (GNUM_HOSPITAL_CODE,NUM_IT_ING_STORE_ID,NUM_ITEM_ID,NUM_IT_ING_ID,GNUM_SLNO,GDT_EFFECTIVE_FRM,GDT_EFFECTIVE_TO,GDT_ENTRY_DATE,GNUM_ISVALID,GNUM_SEAT_ID,GSTR_REMARKS) VALUES (?,?,?,?,?,?,?,?,?,?,?)
	 </QRY>
   </BLOCK>
   <BLOCK ID="3" QRY_SIZE="1" ROWS_INS="S" MANDATORY="Y">
    <QRY ID="1" COL_SIZE="5">
     UPDATE PISWCA_CANTEEN_ITEM_INGD1_MST SET GDT_LSTMOD_DATE=?,GNUM_LSTMOD_SEATID=? where NUM_IT_ING_STORE_ID=? and GNUM_HOSPITAL_CODE=? and GNUM_SLNO=?
    </QRY>
   </BLOCK>
    <BLOCK ID="4" QRY_SIZE="1" ROWS_INS="S" MANDATORY="Y">
    <QRY ID="1" COL_SIZE="5">
     UPDATE PISWCA_CANTEEN_ITEM_INGD2_MST SET GDT_LSTMOD_DATE=?,GNUM_LSTMOD_SEATID=? where NUM_IT_ING_STORE_ID=? and GNUM_HOSPITAL_CODE=? and GNUM_SLNO=?
    </QRY>
   </BLOCK>
	
</OPR>
 
<OPR ID="5" NAME="DELETE" BLOCK_SIZE="2" QRY_TOT_SIZE="2" TRN_MGMT="Y">
	<BLOCK ID="1" QRY_SIZE="1" ROWS_INS="S" MANDATORY="Y">
	 <QRY ID="1" COL_SIZE="5">
	 UPDATE piswca_canteen_item_ingd1_mst SET GDT_LSTMOD_DATE=?,GNUM_LSTMOD_SEATID=?, GNUM_ISVALID=0 WHERE NUM_IT_ING_STORE_ID=? AND GNUM_SLNO=? AND GNUM_HOSPITAL_CODE=?
	</QRY>
	</BLOCK>
	<BLOCK ID="2" QRY_SIZE="1" ROWS_INS="M" MANDATORY="Y">
	<QRY ID="1" COL_SIZE="5">
	 UPDATE piswca_canteen_item_ingd2_mst SET GDT_LSTMOD_DATE=?,GNUM_LSTMOD_SEATID=?, GNUM_ISVALID=0 WHERE NUM_IT_ING_STORE_ID=? AND GNUM_SLNO=? AND GNUM_HOSPITAL_CODE=?
	</QRY>
   </BLOCK>
	
</OPR>



 </tns:Transaction>


