<?xml version="1.0" encoding="UTF-8"?>
<tns:Transaction MODULE_NAME="ESTATE" PROCESS_NAME="ShopVacate" xmlns:tns="http://www.example.org/transactionSchema" xmlns:xsi="http://www.w3.org/2001/XMLSchema-instance" xsi:schemaLocation="http://www.example.org/transactionSchema transactionSchema.xsd ">
  
  <OPR ID="1" NAME="INSERT" BLOCK_SIZE="1" QRY_TOT_SIZE="1" TRN_MGMT="Y">
	<BLOCK ID="1" QRY_SIZE="1" ROWS_INS="S" MANDATORY="Y">
	 <QRY ID="1" COL_SIZE="10">
	 INSERT INTO EST_NOTICE_ISSUE_DTL (GNUM_HOSPITAL_CODE, NUM_NOTICE_ID, STR_NOTICE_NO, DT_NOTICE_DATE,STR_CONTENT, DT_LAST_DATE, STR_TIME, GDT_ENTRY_DATE, GNUM_ISVALID,	GNUM_SEAT_ID) VALUES (?,?,?,?,?,?,?,?,?,?)
	</QRY>
	</BLOCK>
 </OPR>
 
<OPR ID="2" NAME="UPDATE" BLOCK_SIZE="1" QRY_TOT_SIZE="1" TRN_MGMT="N">
 <BLOCK ID="1" QRY_SIZE="1" ROWS_INS="S" MANDATORY="Y">
  <QRY ID="1" COL_SIZE="9">
  UPDATE  EST_NOTICE_ISSUE_DTL SET  STR_NOTICE_NO=?, DT_NOTICE_DATE=?, STR_CONTENT=?, DT_LAST_DATE=?, STR_TIME=?, GDT_LSTMOD_DATE=?, GNUM_LSTMOD_SEATID=?  WHERE  GNUM_HOSPITAL_CODE=? AND NUM_NOTICE_ID=?				
  </QRY>
 </BLOCK>
</OPR>

<OPR ID="3" NAME="DELETE" BLOCK_SIZE="1" QRY_TOT_SIZE="1" TRN_MGMT="N">
 <BLOCK ID="1" QRY_SIZE="1" ROWS_INS="S" MANDATORY="Y">
  <QRY ID="1" COL_SIZE="4">
   UPDATE EST_NOTICE_ISSUE_DTL SET GNUM_ISVALID=0, GDT_LSTMOD_DATE=?, GNUM_LSTMOD_SEATID=?  WHERE GNUM_HOSPITAL_CODE=? AND NUM_NOTICE_ID=?	
  </QRY>
 </BLOCK>
</OPR>
 




 </tns:Transaction>

