<?xml version="1.0" encoding="UTF-8"?>
<tns:Transaction MODULE_NAME="COMITTEE" PROCESS_NAME="PressconfFile Transaction" xmlns:tns="http://www.example.org/transactionSchema" xmlns:xsi="http://www.w3.org/2001/XMLSchema-instance" xsi:schemaLocation="http://www.example.org/transactionSchema transactionSchema.xsd ">
<OPR ID="1" NAME="INSERT" BLOCK_SIZE="3" QRY_TOT_SIZE="3" TRN_MGMT="Y">
  <BLOCK ID="1" QRY_SIZE="1" ROWS_INS="S" MANDATORY="Y">
	<QRY ID="1" COL_SIZE="9">
	 INSERT INTO PISPR_PRESS_CONF_TRN(GNUM_HOSPITAL_CODE,STR_SERIAL_NO,DT_DATE,STR_TIME,STR_VENUE,GDT_EFFECT_DATE,GDT_ENTRY_DATE,GNUM_ISVALID,GNUM_SEAT_ID) VALUES(?,?,?,?,?,?,?,?,?)
	</QRY>
   </BLOCK>
   <BLOCK ID="2" QRY_SIZE="1" ROWS_INS="S" MANDATORY="Y">
	<QRY ID="1" COL_SIZE="11">
	 INSERT INTO PISPR_PRESS_CONF_COND_DTL(GNUM_HOSPITAL_CODE,STR_SERIAL_NO,DT_DATE,GDT_EFFECT_DATE,GDT_ENTRY_DATE,GNUM_ISVALID,GNUM_SEAT_ID,STR_EMP_CODE,STR_EMP_NAME,STR_DESIGNATION,STR_DEPARTMENT) VALUES(?,?,?,?,?,?,?,?,?,?,?)
	</QRY>
   </BLOCK>
      <BLOCK ID="3" QRY_SIZE="1" ROWS_INS="M" MANDATORY="Y">
	<QRY ID="1" COL_SIZE="10">
	 INSERT INTO PISPR_PRESS_CONF_CONF_DTL(GNUM_HOSPITAL_CODE,STR_SERIAL_NO,DT_DATE,GDT_EFFECT_DATE,GDT_ENTRY_DATE,GNUM_ISVALID,GNUM_SEAT_ID,STR_TOPIC_ABOUT,STR_RELA_TO_DEPT,STR_DESCRIPTION) VALUES(?,?,?,?,?,?,?,?,?,?)
	</QRY>
   </BLOCK>
</OPR>
<OPR ID="2" NAME="INSERT" BLOCK_SIZE="5" QRY_TOT_SIZE="5" TRN_MGMT="Y">
    <BLOCK ID="1" QRY_SIZE="1" ROWS_INS="M" MANDATORY="Y">
    <QRY ID="1" COL_SIZE="2">
      DELETE FROM PISPR_PRESS_CONF_COND_DTL A WHERE A.STR_SERIAL_NO=? AND A.GNUM_HOSPITAL_CODE=?
    </QRY>
    </BLOCK>
    <BLOCK ID="2" QRY_SIZE="1" ROWS_INS="M" MANDATORY="Y">
    <QRY ID="1" COL_SIZE="2">
      DELETE FROM PISPR_PRESS_CONF_CONF_DTL A WHERE A.STR_SERIAL_NO=? AND A.GNUM_HOSPITAL_CODE=?
    </QRY>
    </BLOCK>
    <BLOCK ID="3" QRY_SIZE="1" ROWS_INS="S" MANDATORY="Y">
	<QRY ID="1" COL_SIZE="7">
	 UPDATE PISPR_PRESS_CONF_TRN SET DT_DATE =?,STR_TIME=?,STR_VENUE=?,GDT_LSTMOD_DATE=?,GNUM_LSTMOD_SEATID=? WHERE  STR_SERIAL_NO=? AND GNUM_HOSPITAL_CODE=?
	</QRY>
    </BLOCK>
    <BLOCK ID="4" QRY_SIZE="1" ROWS_INS="M" MANDATORY="Y">
	<QRY ID="1" COL_SIZE="13">
	 INSERT INTO PISPR_PRESS_CONF_COND_DTL(GNUM_HOSPITAL_CODE,STR_SERIAL_NO,DT_DATE,GDT_EFFECT_DATE,GDT_ENTRY_DATE,GNUM_ISVALID,GNUM_SEAT_ID,GDT_LSTMOD_DATE,GNUM_LSTMOD_SEATID,STR_EMP_CODE,STR_EMP_NAME,STR_DESIGNATION,STR_DEPARTMENT) VALUES(?,?,?,?,?,?,?,?,?,?,?,?,?)
	</QRY>
    </BLOCK>
      <BLOCK ID="5" QRY_SIZE="1" ROWS_INS="M" MANDATORY="Y">
	<QRY ID="1" COL_SIZE="12">
	 INSERT INTO PISPR_PRESS_CONF_CONF_DTL(GNUM_HOSPITAL_CODE,STR_SERIAL_NO,DT_DATE,GDT_EFFECT_DATE,GDT_ENTRY_DATE,GNUM_ISVALID,GNUM_SEAT_ID,GDT_LSTMOD_DATE,GNUM_LSTMOD_SEATID,STR_TOPIC_ABOUT,STR_RELA_TO_DEPT,STR_DESCRIPTION) VALUES(?,?,?,?,?,?,?,?,?,?,?,?)
	</QRY>
   </BLOCK>
</OPR>
<OPR ID="3" NAME="DELETE" BLOCK_SIZE="3" QRY_TOT_SIZE="3" TRN_MGMT="Y">
  <BLOCK ID="1" QRY_SIZE="1" ROWS_INS="S" MANDATORY="Y">
    <QRY ID="1" COL_SIZE="2">
      UPDATE PISPR_PRESS_CONF_TRN A  SET A.GNUM_ISVALID=0 WHERE STR_SERIAL_NO=? AND A.GNUM_ISVALID=1 AND A.GNUM_HOSPITAL_CODE=?
    </QRY>
  </BLOCK>
    <BLOCK ID="2" QRY_SIZE="1" ROWS_INS="S" MANDATORY="Y">
    <QRY ID="1" COL_SIZE="2">
      UPDATE  PISPR_PRESS_CONF_COND_DTL A  SET A.GNUM_ISVALID=0 WHERE STR_SERIAL_NO=? AND A.GNUM_ISVALID=1 AND A.GNUM_HOSPITAL_CODE=?
    </QRY>
  </BLOCK>
    <BLOCK ID="3" QRY_SIZE="1" ROWS_INS="S" MANDATORY="Y">
    <QRY ID="1" COL_SIZE="2">
      UPDATE  PISPR_PRESS_CONF_CONF_DTL A  SET A.GNUM_ISVALID=0 WHERE STR_SERIAL_NO=? AND A.GNUM_ISVALID=1 AND A.GNUM_HOSPITAL_CODE=?
    </QRY>
  </BLOCK>
</OPR>



</tns:Transaction>