<?xml version="1.0" encoding="UTF-8"?>

<tns:Transaction MODULE_NAME="PIS" PROCESS_NAME="ConfSettlement" xmlns:tns="http://www.example.org/transactionSchema" xmlns:xsi="http://www.w3.org/2001/XMLSchema-instance" xsi:schemaLocation="http://www.example.org/transactionSchema transactionSchema.xsd ">
  
  <OPR ID="1" NAME="INSERT" BLOCK_SIZE="1" QRY_TOT_SIZE="1" TRN_MGMT="N">
	<BLOCK ID="1" QRY_SIZE="2" ROWS_INS="S" MANDATORY="Y">
	 <QRY ID="1" COL_SIZE="24">
	 INSERT INTO PIST_CONF_SETTLE_TRN (STR_SANC_ORDER_NO,DT_SANC_DATE,STR_EMPLOYEE_CODE,STR_CURRENT_BASIC,STR_PAY_SCALE, NUM_TA_CLAIMED,NUM_DA_CLAIMED,NUM_REGISTRATION_FEE,NUM_AIRPORT_TAX,NUM_VISA_FEE,NUM_APPLICATION_FEE,NUM_HLTH_INS_CHARG,NUM_TAKEN_GRANT, NUM_TOT_AMT_CLAIMED,NUM_TOT_ADV_TAKEN,NUM_NET_AMT_CLAIMED,NUM_TOT_AMT_ADMISSIBLE,NUM_NET_AMT_ADMISSIBLE,STR_STATUS,GNUM_ISVALID,GDT_EFFECT_DATE,GDT_ENTRY_DATE,GNUM_SEAT_ID,GNUM_HOSPITAL_CODE) VALUES (?,?,?,?,?,?,?,?,?,?,?,?,?,?,?,?,?,?,?,?,?,?,?,?)
	</QRY>
	
	 <QRY ID="1" COL_SIZE="22">
	 INSERT INTO PIST_CONF_SETTLE_DTL (STR_SANC_ORDER_NO,DT_SANC_DATE,STR_EMPLOYEE_CODE,STR_DEPT_STATION,DT_DEPT_DATE,STR_DEPT_TIME,STR_ARRV_STATION,DT_ARRV_DATE,STR_ARRV_TIME,NUM_OF_KM,STR_MODE_OF_JOURNEY,NUM_OF_DAYS,NUM_TOT_AMT_CLAIMED,STR_TICKET_NOS,NUM_AMT_ADMISSIBLE,STR_MILEAGE,STR_STATUS,GNUM_ISVALID,GDT_EFFECT_DATE,GDT_ENTRY_DATE,GNUM_SEAT_ID,GNUM_HOSPITAL_CODE) VALUES (?,?,?,?,?,?,?,?,?,?,?,?,?,?,?,?,?,?,?,?,?,?)
	</QRY>
		 
	</BLOCK>
	
</OPR>

<OPR ID="2" NAME="INSERT" BLOCK_SIZE="1" QRY_TOT_SIZE="1" TRN_MGMT="N">
	<BLOCK ID="1" QRY_SIZE="2" ROWS_INS="S" MANDATORY="Y">
	 <QRY ID="1" COL_SIZE="13">
	 UPDATE PIST_CONF_SETTLE_TRN T SET T.STR_VERIFY_STATUS=?,T.DT_VERIFY_DATE=?,T.STR_REM_FOR_VERIFY=?,T.STR_NAME_OF_HOD=?,T.STR_BILL_NUMBER=?,T.DT_BILL_DATE=?,T.STR_STATUS=?,T.GNUM_ISVALID=?,T.GDT_EFFECT_DATE=?,T.GDT_ENTRY_DATE=?,T.GNUM_SEAT_ID=? WHERE T.STR_SANC_ORDER_NO=? AND T.GNUM_HOSPITAL_CODE=?
	</QRY>
	
	 <QRY ID="1" COL_SIZE="3">
	  UPDATE PIST_CONF_SETTLE_DTL SET STR_STATUS=? WHERE STR_SANC_ORDER_NO=? AND GNUM_HOSPITAL_CODE=?
	 </QRY>
	 </BLOCK>
</OPR>


</tns:Transaction>

