<?xml version="1.0" encoding="UTF-8"?>
<tns:Transaction MODULE_NAME="COMPILATION" PROCESS_NAME="act_catMaster" xmlns:tns="http://www.example.org/transactionSchema" xmlns:xsi="http://www.w3.org/2001/XMLSchema-instance" xsi:schemaLocation="http://www.example.org/transactionSchema transactionSchema.xsd ">
  
  	<OPR ID="1" NAME="INSERT" BLOCK_SIZE="7" QRY_TOT_SIZE="10" TRN_MGMT="N">
  
	
	<BLOCK ID="1" QRY_SIZE="1" ROWS_INS="S" MANDATORY="Y">
	<QRY ID="1" COL_SIZE="24">
	INSERT INTO actcom_d_pvt_app_trn (GNUM_HOSPITAL_CODE,STR_DEMAND_NUMBER,DT_DEMAND_DATE,STR_RECEIVED_THROUGH,STR_GRANT_TYPE_CODE,NUM_DEPT_CODE,STR_SCHEME_CODE,STR_PROJECT_CODE,STR_DEMAND_CODE,STR_DEMAND_APPROVED,DT_DEMAND_APPROVED_DATE,STR_DEMAND_APPROVED_BY,STR_DEMAND_REMAKRS,STR_STATUS_CODE,STR_DEMAND_STATUS,STR_BILL_PASS_FOR_CHEQUE_PRE,DT_CHEQUE_PREP,NUM_TOTAL_AMOUNT,GDT_EFFECT_DATE,GDT_ENTRY_DATE,GNUM_ISVALID,GNUM_SEAT_ID,STR_DEMAND_RECEIVED,DT_DEMAND_RECEIVED_DATE) VALUES (?,?,?,?,?,?,?,?,?,?,?,?,?,?,?,?,?,?,?,?,?,?,?,?)
	</QRY>
	</BLOCK>

	<BLOCK ID="2" QRY_SIZE="1" ROWS_INS="S" MANDATORY="Y">
	<QRY ID="1" COL_SIZE="11">
	INSERT INTO actcom_d_pvt_app_lp_dtl(GNUM_HOSPITAL_CODE,STR_DEMAND_NUMBER,DT_DEMAND_DATE,STR_TYP_LED_HED_CODE,STR_LED_HED_CODE,STR_STATUS_CODE,STR_DEMAND_STATUS,GDT_EFFECT_DATE,GDT_ENTRY_DATE,GNUM_ISVALID,GNUM_SEAT_ID) VALUES (?,?,?,?,?,?,?,?,?,?,?)
	</QRY>
	</BLOCK>
	
	<BLOCK ID="3" QRY_SIZE="1" ROWS_INS="S" MANDATORY="Y">
	<QRY ID="1" COL_SIZE="30">
	INSERT INTO actcom_d_pvt_a_exp_bo_dtl  (GNUM_HOSPITAL_CODE,STR_DEMAND_NUMBER,DT_DEMAND_DATE,STR_GRANT_TYPE_CODE,NUM_DEPT_CODE,STR_SCHEME_CODE,STR_PROJECT_CODE,NUM_PAYMENT_SLNO,STR_PAYMENT_CHK,STR_SALARY_HEAD,NUM_SALARY_AMOUNT,STR_MAJOR_HEAD_CODE,STR_SUB_MAJOR_HEAD_CODE,STR_MINOR_HEAD_CODE,STR_SUB_MINOR_HEAD_CODE,STR_AMOUNT_HEAD,STR_STATUS_CODE,STR_DEMAND_STATUS,GDT_EFFECT_DATE,GDT_ENTRY_DATE,GNUM_ISVALID,GNUM_SEAT_ID,
	STR_TO_GRANT_TYPE_CODE ,NUM_TO_DEPT_CODE ,STR_TO_SCHEME_CODE ,STR_TO_PROJECT_CODE ,STR_TO_MAJOR_HEAD_CODE,
  STR_TO_SUB_MAJOR_HEAD_CODE ,  STR_TO_MINOR_HEAD_CODE ,STR_TO_SUB_MINOR_HEAD_CODE) 
  VALUES   (?,?,?,?,?,?,?,?,?,?,?,?,?,?,?,?,?,?,?,?,?,?,?,?,?,?,?,?,?,?)
	</QRY>
	</BLOCK>
		

	<BLOCK ID="4" QRY_SIZE="1" ROWS_INS="S" MANDATORY="Y">
	<QRY ID="1" COL_SIZE="30">
	INSERT INTO actcom_d_pvt_a_exp_bo_dtl  (GNUM_HOSPITAL_CODE,STR_DEMAND_NUMBER,DT_DEMAND_DATE,STR_GRANT_TYPE_CODE,NUM_DEPT_CODE,STR_SCHEME_CODE,STR_PROJECT_CODE,NUM_PAYMENT_SLNO,STR_PAYMENT_CHK,STR_SALARY_HEAD,NUM_SALARY_AMOUNT,STR_MAJOR_HEAD_CODE,STR_SUB_MAJOR_HEAD_CODE,STR_MINOR_HEAD_CODE,STR_SUB_MINOR_HEAD_CODE,STR_AMOUNT_HEAD,STR_STATUS_CODE,STR_DEMAND_STATUS,GDT_EFFECT_DATE,GDT_ENTRY_DATE,GNUM_ISVALID,GNUM_SEAT_ID,
	STR_TO_GRANT_TYPE_CODE ,NUM_TO_DEPT_CODE ,STR_TO_SCHEME_CODE ,STR_TO_PROJECT_CODE ,STR_TO_MAJOR_HEAD_CODE,
  STR_TO_SUB_MAJOR_HEAD_CODE ,  STR_TO_MINOR_HEAD_CODE ,STR_TO_SUB_MINOR_HEAD_CODE) 
  VALUES (?,?,?,?,?,?,?,?,?,?,?,?,?,?,?,?,?,?,?,?,?,?,?,?,?,?,?,?,?,?)
	</QRY>
	</BLOCK>

	<BLOCK ID="5" QRY_SIZE="1" ROWS_INS="S" MANDATORY="Y">
	 <QRY ID="1" COL_SIZE="2">
	  UPDATE  actcom_d_pvt_rcev_trn SET STR_DEMAND_STATUS=? WHERE STR_DEMAND_NUMBER=?
	</QRY>
	</BLOCK>
	
	 <BLOCK ID="6" QRY_SIZE="1" ROWS_INS="S" MANDATORY="Y">
	 <QRY ID="1" COL_SIZE="2">
	  UPDATE  actcom_d_pvt_recv_lp_dtl SET STR_DEMAND_STATUS=? WHERE STR_DEMAND_NUMBER=?
	</QRY>
	</BLOCK>
	
	 <BLOCK ID="7" QRY_SIZE="1" ROWS_INS="S" MANDATORY="Y">
	 <QRY ID="1" COL_SIZE="2">
	  UPDATE  actcom_d_pvt_r_exp_bo_dtl SET STR_DEMAND_STATUS=? WHERE STR_DEMAND_NUMBER=?
	</QRY>
	</BLOCK>
	
	
</OPR>
</tns:Transaction>
 
